{
  "api_version": "1.0",
  "run_id": "h2o-f2-fusion-aimd-001",
  "task_id": "h2o-f2-fusion-aimd-001.classical-call-001",
  "method": "predict",
  "payload": {
    "request_id": "h2o-f2-energy-batch-001",
    "sample_ids": ["geometry-0001"],
    "features": [[0.1, -0.2, 0.3, 0.05, -0.07, 0.11, -0.13, 0.17, -0.19, 0.23, -0.29, 0.31, -0.37, 0.41]]
  },
  "timeout_seconds": 60.0,
  "metadata": {
    "role": "energy-inference"
  }
}
